answers,question
"[""Do you play any instruments?no, i don't play anything with my guitar."", 'Where are you from? Seoul, South Korea.', 'Are you from the Boston area? I am from the Northeast.', ""Where do usually go running/hiking in Boston? I'm a big fan of running along the Charles--can't beat that view of Boston."", 'Where are you from? Seoul, South Korea.', ""<|startoftext|>I love reading you, and i really enjoy playing video games, What's your favorite TV show? I can't pick a favorite, there's so many great shows that are written and acted on so"", 'What are your hobbies? My hobbies include biking and reading.', ""Are you from there originally? I'm actually from SoCal, I just ended up getting stuck here."", 'how do you like ur new job? I like it, but I feel as though I could never get a decent one.', 'How are you doing today? Doing well? I feel good.', ""How's the weather over there? It's quite chilly over there so I'll be having family tomorrow."", ""So do you like swimming? Well, I'm a big fan of running. I'm not a big fan of swimming."", 'What are you studying? Evolutionary biology.', ""Is it usually that bad in winter? no, this is the worst one i've ever seen."", 'Do you travel a lot or just take weekends? I have taken my weekend off from me to travel a lot lately, I will be travelling to travel with my family.', ""What do you think of the new Jets cap? I don't really like the current one."", ""How are you doing today? I'm well."", 'How are you? Worn out? Least of my friends except me.', 'What are you studying? Evolutionary biology.', 'Do you hope to do some gigging soon? i hope to do some gigging soon.']",
"[' I usually go to Foxwoods and then back to the city.', ' I like to go to Foxwoods and Mturk which are other places where I like to go running/hiking.', '<|startoftext|>what do you like to do for fun during the weekend? I like to play tennis during the day but I also like to go running around Cambridge - what about you? I like to go running around Cambridge - what about you? I like to go running around', ' I usually go to the beach.', ' I like to play tennis and go rock climbing.', "" I like to go out to bars on the weekends, but if I'm stressed out then I'll usually head out to eat."", ' I usually go to movies and do specialty events like that.', ' I like to go to the movies', "" I like to go out to bars on the weekends, but if I'm too tired I usually stay in and watch movies."", '<|startoftext|>what do you like to do for fun during the weekend? I like to swim, play video games, play Magic: The Gathering, watch Netflix, go to bars, have parties, cook, workout, eat lots of food,<|endoftext|', ' I usually stay in on the action through my tv and listen to music.', ' I like to watch a movie (on Saturday, I watch both) or go to a concert (on Sunday, I go eat).', ' I like to play basketball during the day and brunch at night.', ' I like to bowl, watch movies and go out with my friends.', ' I like to watch a football game or two during the day and watch movies during the evening.', "" I like to go out to bars on the weekends, but if I'm tired I go to eat or just chill out."", ' I usually go to Foxwoods before work, although I have been to a few others, so I might add Daytona Beach.', ' I like to bowl, watch movies and go out with my friends.', ' I like to go to the movies.', ' I like to watch movies and do odd jobs.']",what do you like to do for fun during the weekend?
"[' I like to play basketball or tennis and watch a live stream of the game from my living room.', ' I like to bowl, watch movies, go out with my friends, have parties, cook.', ' I like to play tennis or just go out playing tennis.', ' I like to bowl, go to bars, go out on the weekends, do alot of stuff at the library, and I like to go out to bars.', ' I like getting together with friends.', ' I like to play tennis and go rock climbing.', ' I like to play pool with friends or just play tennis.', ' I like to play tennis and go rock climbing.', ' I like to play tennis and go rock climbing.', ' I like to play basketball or just walk around Boston.', ' I like to play basketball or something and watch movies.', ' I like to play tennis and go rock climbing.', ""<|startoftext|>What do you like to do for fun around here? I like to play video games in my spare time, which I used to be seriously suicidal I admit, I don't have a life changing event where I haven't happened yet.<|endoftext"", ' I like to play basketball or just relax by walking mturker.', '<|startoftext|>What do you like to do for fun around here? I like to bowl, go to festivals, and do my bit to help out my parents nether? I also like to ride my bike, go to hortons, bike alone in my hometown', ' I like to swim, play video games, play Magic: The Gathering, go to bars, go to live music events, eat lots of food,', ' I like to bowl, do alot of out door activities, and am very involved with my friends sports scene.', ' I like to bowl, watch movies and go out with my friends.', ' I like to play basketball or just walk around Boston', ' I like to go out in nature photographing whales.']",What do you like to do for fun around here?
"[' I like to party in my free time and have lots of fun/sports/movies to watch', ' I enjoy going out to eat or taking walks along the river.', ' I like to party (and bike) with friends.', ' I like getting together with friends.', ' I love to hike with my family, go hiking with my cousin, go biking by the river, and just generally be nice.', ' I love to watch movies and reading online.', ' I like to bit-fight, gore-watch, yoga, fast foods,', ' I love to hike with my family, go hiking with my fiance, or just hike with me sometimes.', ' I like to trawl the internet for good old fashioned sports info about the NFL and find games that I think are interesting to watch.', ' I love to hike with my family, go on hikes with my fiance, or ride my bicycle around the area with me,', ' I like to swim, bike, play video games, go to bars, go to live music events, eat lots of food,', ' I enjoy going out to eat or just walking around.', ' I enjoy swimming, hiking, and the beach.', ' I love to hike with my family and go to many festivals.', ' I love to hike with my family, go hiking with my cousin, go on hikes with my dad, and so much more.', ' I like getting together with friends.', ' I love to hike with my family, go hiking alone, and do other type of trail work.', ' I enjoy walking along the river, The beach, in bloom, and in the winter, spending time with my family.', '<|startoftext|>what do you enjoy doing for fun? I like bungee jumping, going for runs, party taking up to bathrooms, I also like going out to the movies, Cooking for FUN, golfing, hiking, watching movies<|endof', ' I love to hike with my family, go hiking with my dog, go on foot hikes with my cousin, ride a bike around the city, I love it.']",what do you enjoy doing for fun?
"[' I like to play a variety of club sports at home.', ' I like to play sports.', ' I like to play sports.', ' I like to play tennis and go rock climbing.', ' I like to play tennis or just walk around Boston.', ' I like to play sports.', ' I like to play tennis and go rock climbing.', ' I like to play tennis or just walk around Boston.', ' I like to play tennis and go rock climbing.', ' I like to play tennis and go rock climbing.', ' I like to play tennis and go rock climbing.', ' I like to play tennis or just go rock climbing.', ' I like to play tennis and do cross country skiing.', ' I like to play tennis and go rock climbing.', ' I like to play tennis or play tennis with my friends.', ' I like to play tennis and go rock climbing.', ' I like to play a variety of club sports at the college.', ' I like to play tennis and go rock climbing.', ' I like to play tennis or just rock and roll.', ' I like to play tennis and go rock climbing.']",What do you like to do for fun?
"[' I like to play a variety of club sports at the college.', ' I like to play sports during the day and I watch movies during the night. I also like to play basketball when I have time during the day.', ' I like to play tennis and go rock climbing.', ' I like to play a variety of club sports at the college.', ""<|startoftext|>What do you do for fun? I like to play an old game I've been playing called ping pong called Rumble where you have to move and shoot each other with your racketeering skills until you spot a hole.<|endof"", ' I like to play a variety of club sports at the college.', ' I like to play a variety of club sports at the college.', '<|startoftext|>What do you do for fun? I like to play an instrumental game called flute, where you pick your favorite string and play it over and over until you get to the last string. Most of the time, I pick the', ' I like to play a variety of club sports at the college.', ' I like to play a variety of club sports at the college.', ' I like to play an orchestra during the day and watch movies during the night.', ' I like to play a variety of club sports at the college.', ' I like to play sport in downtown london.', ' I like to play a variety of club sports at the college.', ' I like to play p2p gaming when I have downtime and have enough to eat.', ' I like to play a variety of club sports at the college.', ' I like to play a variety of club sports at the college.', ' I like to play sport at my local high school.', ' I like to play a variety of club sports at the college.', ' I like to play a variety of club sports at the college.']",What do you do for fun?
"[' I love to hike with my family.', ' I love to hike with my family.', ' I love to hike with my family.', ' I like to play tennis and do movies.', ' I love to hike with my family and go hiking with my friend.', ' I love to hike with my family.', ' I love to hike with my family.', ' I love to hike with my family, so hiking are your top hobbies? Trees, for sure.', ' I love to hike with my family.', ' I love to hike with my family and do community service events.', ' I love to hike with my family.', ' I like to play sports.', ' I like to play basketball when I have time, read books or just relax when not needed.', ' I love to hike with my family.', ' I love to hike with my family.', ' I like to play tennis and go rock climbing.', ' I love to hike with my family.', ' I like to play tennis and go rock climbing.', ' I like to play soccer and listen to music.', ' I love to hike with my family.']",What do you do for fun in your sparetime?
"[' I like to play a variety of club sports at the college.', ""<|startoftext|>What do you do for fun around here? I like to play sports at a friend's (even though I'm a junior), play tennis, listen to music, and go to bars. I love meeting new people, hearing about new people,"", ' I like to play basketball or just relax by the water.', ' I like to play a variety of club sports at the college.', ' I like to play basketball and go rock climbing.', ' I like to play a variety of club sports at the college.', ' I like to play tennis and do some other kind of club sports too.', ' I like to play a variety of club sports at the college.', ' I like to play a variety of club sports at the college.', ' I like to play a variety of club sports at the college.', ' I like to play a variety of club sports at the college.', ' I like to play a variety of club sports at the college.', ' I like to play a variety of club sports at the college.', ' I like to play a variety of club sports at the college.', ' I like to play basketball or tennis and go out to bars or anywhere interesting to drink.', ' I like to play a variety of club sports at the college.', ' I like to play basketball and go rock climbing.', ' I like to play basketball when I have time during the day, eat good food, drink generally, and just chill out.', ' I like to play a variety of club sports at the college.', ' I like to play tennis and go rock climbing.']",What do you do for fun around here?
"[""<|startoftext|>What do you do in your spare time? I spend most of my time turking and i recently started traveling so I might ask... are you in any clubs or just hanging out with some friends' rules say: unfortunately, no.<|end"", "" I'm a college administrator."", ' I am a freelance consultant in the nonprofit sector.', "" I'm a freelance consultant in Chicago."", ' I am unemployed but this is ok because I recieved a small inheratence that I am living on for now.', "" I'm working full-time and having a hard time finding a job so I eat, sleep and do a little bit of everything."", ""<|startoftext|>What do you do in your spare time? Nothing really, I've been gaming since I was 7 and I love collecting cards, but since I don't have any hobbies, I mostly spend my time playing video games on my cell phone, which"", "" I'm a homemaker and I help run my own business."", ' I am a college administrator.', ' I am a college administrator.', "" I'm a consultant in a large consulting company."", ' I usually just work and not much other than play video games, but I watch a lot of movies.', ' I am unemployed and have a real hard time finding a job so I spend time with family and friends.', "" Well... I like to gamble, so that I can't- "", ' I am a freelance consultant in New England.', "" I'm a consultant in a large medical organization."", ' I basically spend time with my family and friends, my hobbies include biking and reading.', ' nothing really.', ' I am unemployed and have a lot of stuff up my esky, but nothing major other than family... ', "" I am unemployed and have a lot of debt, so that's how I spend my time.""]",What do you do in your spare time?
"[' I like to watch movies, travel, go surfing, play video games.', ' I basically spend time with my family, go to festivals and such, concerts.', ' I like to watch movies, travel, go surfing, play video games.', ' I like to watch movies, travel, go surfing, play video games.', ' I like to watch movies, go surfing, play video games, listen to music, cook, and workout. ', ' I basically spend time with my family, go to festivals and such, concerts.', ' I like to watch movies, travel, go surfing, play video games.', ' I like to watch movies, travel, go surfing, play video games.', ' I spend time with family, go to festivals and such, to name a few. I also like to run into my family, my daughter and I,', ' I basically spend time with my family, read, and my pets.', ' I like to watch movies and do a little cooking.', ' I like to gamble, exercise, and travel!', ' I like to watch movies and travel,', ' I basically spend time with my family, read, and listen to music.', ' I like to watch movies, go out with my friends, have parties, cook, and...I also like to travel!', ' Well, nothing special... facebook or chatting.', ' I spend most of my time turking.', ' I like to watch movies and do movie night.', ' I like to watch movies, go to festivals, go places with friends, play sports.', ' I like to watch movies, go surfing, play video games, go to bars, listen to music, cook, workout, and do a few other things.']",What do you like to do in your free time?
"[' I love to watch movies and travel. ', ' I love to watch movies and travel. I also like to ski.', ' I love to watch movies and travel. :) What about you? I love to watch movies.', ' I love to watch movies and travel. I also love spending time with family and friends.', ' I love to watch movies and I like to gamble.', ' I love to watch movies.', ' I like to watch movies, go surfing, go out with my friends, have parties, cook, watch movies.', ' I like to gamble, exercise, and go out to bars most days. I also like to go out to coffee spots and speakeasies most days. ', ' I basically spend time with my family, go to festivals and such, I love eating vegetarian foods.', ' I love to watch movies and play video games.', ' I love to watch movies and do other stuff.', "" I'm a gamer too - like myself :) I like video games too, but not as much as I use to."", ' I love to watch movies.', ' I enjoy traveling, visiting family, eating food, having parties, and generally being kind to others.', ' I love to watch movies.', ' I like to watch movies, travel, go surfing, play video games.', "" I love to watch movies and travel. I'm a geophysicist so I also love to watch movies."", ' I like to watch a bunch of movies, go to bars occasionally, and travel. ', ' I like watching documentaries about great places and I like playing online especially on Xbox 360.', ' I love to watch movies and I cook.']",What do you enjoy doing in your free time?
"[' nothing much.', ' I am a consultant in a large medical organization group.', ""<|startoftext|>What do you do in your spare time? I'm working on something new--a Netflix binge-listening list--so I spend time with friends, make plans for the weekend, watch Netflix, and listen to music.<|endoftext"", "" I'm usually out in nature photographing something."", "" I'm a sports fan."", ' nothing boring, just hanging out with some friends.', ' nothing super boring, I would rather be busy than have to worry about the future.', "" I like to play video games but I don't enjoy blogging as much as I should."", ' I like to gamble, exercise, and go out to bars occasionally.', "" I'm a consultant in a large defense industry firm."", "" I'm a consultant in a large defense sector company."", ' nothing.. but I like to play a variety of club sports.', ' I like to play baseball and listen to music.', ' I... I like to watch movies.', "" I'm a consultant in a nonprofit associated with the National Endowments."", ' I like to gamble, exercise, and go out to bars sometimes.', "" I'm a consultant in a large accounting company."", "" I'm a consultant in a large medical organization."", ' nothing.. I adored watching you did.', ' Not much, just watching movies.']",What do you do in your spare time?
"[' I like to ride my bike around the area, play video games, go out with my friends, have pizza, drink with my friend, eat Italian food,', "" I'm a stay at home mom."", ' Well, I did my undergraduate work in psychology and media studies (psychology and media studies).', "" I'm a stay at home dad kind of person so I work two jobs and live on campus."", '<|startoftext|>What kinds of things do you enjoy? Well, I am a grad student at the Savannah Sill Air Force Academy and I like to ski and I like swimming. I also like swimming and getting down my mountain bike. <|endof', "" When I'm not doing schoolwork or working, I like to play sports, listen to music, and go out to bars."", "" I like to hike and I like to ski. I haven't been much of a sprinter so I also haven't been much of a skier."", "" Well, I'm a runner mostly."", "" I've been traveling a lot lately, and playing video games."", '<|startoftext|>What kinds of things do you enjoy? Mostly cooking, drinking beer, spending time with family, harkening back to the heyday of beer? I kid, I like watching a movie, going to bars, or just hanging out with', ' I like to gamble, exercise, and go out to bars on the weekends, but I also enjoy swisher climes.', ' I like to ride my bicycle around the area, play video games, listen to music, eat lots of food,', ' I love to watch movies.', ' Well, I do a lot of yoga.', "" I like to gamble, exercise, and go out to bars on the weekends, despite the fact that I'mLoading...\n"", ' I like to gamble, exercise, and go out to bars in the morning.', "" Besides walking? I like to hike and I like to ski as well. I'm not a skier... I like to ski, too!"", ""<|startoftext|>What kinds of things do you enjoy? Mostly laundry, my favorite thing is when I'm doing research in the morning and my work is done at 5:00 pm., my hobbies include gardening, traveling, hiking, crafting, crafting, traveling"", ' Well, I mostly play video games so I have time for that.', "" I'm a stay at home dad type of person, I also like to hike and I like soccer too.""]",What kinds of things do you enjoy?
"[' I like to gamble, exercise, and go out to bars on the weekends, although that sounds like my life as a whole to me.', ' I love to hike and I also love yoga.', ' I like to ride my bicycle, go to festivals, and do other type of active things.', "" I'm a pharmacist."", ' I enjoy reading, hiking, and the beach.', "" I'm a runner so I like to run along the river or along the embankment."", ' Being out in nature with friends.', ' I love to hike with my family and go to bars with my friends.', ' Besides school? I like getting together with friends.', ""<|startoftext|>what kinds of things do you enjoy doing? I love to ride my bike, go to festivals, do bunch riding, lots of running/dance, it's summer stuff so I tend to stay up most of the day.<|endof"", ' I like to hike and I like to bike.', "" I'm a runner, so I do a lot of walking and running."", "" Being outside? I like to play sports at night so it's that kind of stuff."", ' I like to gamble, exercise, and go out to bars', '<|startoftext|>what kinds of things do you enjoy doing? I like to hike and I like to ski. I also ski.[|endoftext|>\n<|startoftext|>Have you ever played a sport? Yes, but I haven', "" I'm a stay at home dad type of person, I go to church, and I watch a million sports per day."", "" I'm a stay at home mom."", "" When I'm not doing schoolwork I like to hike and I like to ski."", "" I'm a student this summer so I have time for work and at work."", "" I used to be able to go anywhere and I used to go out in the cold. Now I'm not.""]",what kinds of things do you enjoy doing?
"[' I usually go to my room bluesy rock shows.', "" I usually go to festivals and stuff, but on occasion I will go to work (though sadly I don't have a job yet)."", ' I like to play basketball during the day and at night I ride a bicycle to work.', "" I like to play basketball or something but I don't usually do much other than watch movies."", ' I like to play basketball or tennis or just walking home from work.', "" I like to play basketball or whatever but I don't have a lot of time with family."", ' I like to play basketball or tennis or just walking home from work.', "" I go to multiple shows a month, but my major is study this week, so that's my main activity."", "" I like to play video games, cook, and party (though I haven't been regularly)."", ' I usually go to my room music college and my free time with my friends.', ' I like to play sports during the day, while at the same time eating pizza.', ' I like to play basketball or something, and if I have time I play tennis.', ' I like to play basketball during the day and hang out with friends during the night.', ' I like to play rock and roll (which I really enjoy), cook, and be fitness-focused.', ' I usually go to bars and eat out.', ' I usually go to a barony or two out of town, if I manage to hang around long enough.', ' I like to play video games and watch movies.', ' I like to play tennis and go rock climbing.', ' I like to play basketball or golf or just walk around.', ' I like to play video games, listen to music, bake, and watch movies.']",what kinds of things do you like to do on the weekends?
"[' I like to ride my bike, go to festivals, and do pretty much anything', ' I like to watch a lot of movies there, but I really enjoy traveling.', ' I like to ride my bike around the area, play video games, go to bars, and listen to music', ' I like to play basketball or just walk around.', ' I like to ride my bike around the area, play video games, go out in the city squares, go to bars, have parties, eat food,', '<|startoftext|>What kinds of things do you like to do in <location>? I like to ride my bike, go to the beach, do a few things in <country>that I really enjoy doing<|startoftext|>\n<|startoftext|>', ' I like to ride my bike, go to bars, go eat, drink beer, have parties, cook, and then have parties.', ' I like to ride my bike around the area, play video games, listen to music, have parties, cook, and maybe even watch some movies.', ' Mostly outdoorsy stuff, I like to hike and camp, that sort of stuff.', ' I like to ride my bike around the area, go to bars, and just hang out with friends.', ' I like to ride my bike around the area, play video games, go out with my friends, have parties, go out with friends.', ' I like to ride my bicycle, go to festivals, go to bars, do pretty much anything.', ' I like to ride my bicycle around the area, play video games, listen to music, have parties, cook, and go out to barbecues.', ' I like to watch a lot of movies, travel a lot, and go to many events.', ' I like to ride my bike, go to bars, go to live music events, eat lots of food,', ' I like to ride my bicycle, go to festivals, go on hikes, and do random other random things.', ' I like to ride my bike around the area, go to festivals, and do alot of these types of things.', ' I like to ride my bike around the area, play video games, go to bars, and do pretty much anything', '<|startoftext|>What kinds of things do you like to do in <location>? I like to ride my bike around the area, play video games, play Magic: The Gathering, go to bars, go to live music events, eat lots of food,<|endoftext', '<|startoftext|>What kinds of things do you like to do in <location>? I like to ride my bike around the area, play video games, play Magic: The Gathering, go to bars, go to live music events, workout, cook, and so on.<|end']",What kinds of things do you like to do in <location>?
