answers,question
"[' I have not. Wow....actually, I think I might tell friends.', ' I think i might, i really like Europe.', ' I think i might, i really liked Italy, hope to see you there.', ' I think maybe once or twice? I think maybe once or twice.', ' I think so.', "" I think I've gone about 15 countries, Europe is my favorite, and Japan is my least favorite."", ' I think we did in 2008.', ' I think I might, in fact, if I thought it through.', "" I think maybe once or twice? I've stayed in the US a few times currently."", "" I think maybe once or twice? I haven't really thought about it."", ' I have not, although I have travelled a lot I just stopped by some places I love.', ' I think I might, I really loved my family., I really enjoy travelling.', ' I think I might go to college.', ' I think i might, i spent 2 months there visiting i love and feeling the same way.', ' I think i might, i really loved georgia but didnt get to do much there until very recently.', ' I think I might, actually, but had to make it to london I think 2010 was my worst year yet.', ' I think so.', ' I think maybe once or twice? I have never left the country.', ' I think i might, i spent 2 months there visiting and i just really liked it.', "" I don't usually go looking for work but I managed to get into a few states because Ilo was an easy walk to the mountains.""]",Have you ever left the country before?
"["" I've been to a few around the world, including a few in the US."", "" I've only gone to Brazil, but I've been to lots of places,''sadly not living in Florida."", "" I've only been to Brazil, but I haven't been very good there."", "" I've been to a few that have comparably sized bars and they're all great."", "" I've only been to Peru, but not for very long."", "" I've been to a few countries in Europe where you can still get money, but it's quite crowded."", "" I've been to a few, but none of them were as awesome as this incredible city."", "" I've been to a few countries in Europe, and they're great."", "" I've only been to Guatemala, so not much really."", "" I've been to a few places, but none of them were as interesting."", "" I've been to a few places, but none of them were as awesome as I have been to here."", "" I've gone to a few places, but nothing as amazing as this one."", "" I've been to a few, but none of them were as nice as my hometown."", "" I've been to a few places, but none of them were as amazing as I am."", "" I've been in Vegas twice already and it was horrible."", "" I've been to a few places, but none of them were as interesting as I am. It all depends on how interesting you are."", "" I've only been to Guatemala, but not for very long."", "" I've been to a few, but none of them were as exciting as I was. Its really nice to be part of something like this."", "" I've been to a few around the South East, but none of them were as nice."", "" I've been to a few, but none of them were as nice.""]",What's the best place you've been?
"["" I loved Chiang Mai and the Bunkley's."", ' I loved Chiang Mai and it was such a long way from my hometown.', ' I loved Chiang Mai, Tokyo, Kyoto, and now...Rice and Muscat.', ' I took the Conservatory for the Ethical Treatment of Animals in Cambridge, but that was before I went to college.', ' I wanted to go to the Swiss Library but the embalming process was too complicated for that.', ' I went to a lot of places, but never in Boston.', "" I've wanted to go to Paris but haven't gotten to it. I went to Rome and I just can't get enough of them!"", ' I loved Chiang Mai and the Philippines.', ' I loved Chiang Mai and its its sooooore.', '<|startoftext|>do you have a favorite place you traveled to? I took the Conservatory for the Deaf and the Middle East., I love walking but I have to say the busier I get, the busier I get the less I like to travel with', ' I really loved Chiang Mai, it was the perfect setting for a family vacation.', ' I loved Chiang Mai, Rome, Paris and Rome on my way to grad school.', ' I loved Chiang Mai and the Philippines.', ' I took the bus to Cambridge in 2013 to travel with my girlfriend (fiance ', ' I loved Chiang Mai and its beaches.', '<|startoftext|>do you have a favorite place you traveled to? I went to the Spanish Quarter in Argentina for a six month tour, then back to Mexico for a three month tour, before finally ending up in Buenos Aires, which I love.<|endoftext', '<|startoftext|>do you have a favorite place you traveled to? I went to the Spanish Fork Mountains with my family, which was a huge part of my childhood. I also went to a reception for the poor in St. Paul, MN.<|endoftext', "" I loved the Spanish mosses there. I have always wanted to go to that area, but haven't gotten to it yet."", ""<|startoftext|>do you have a favorite place you traveled to? I went to a majority of Europe tour, but not as many as in the U.S. I do have a favorite place I went to, but I don't remember which.</|endof"", ' I wish I could have gone to so I have to admit, it was a lot of fun.']",do you have a favorite place you traveled to?
"[' I would probably say home was better known for art exhibits and events.', ' I would say getting up late to visit my siblings and I was missing my parents yesterday because I was taking photos of the house.', ' I would say visiting is like getting off work at 6 in the morning and walking around town. I really enjoyed my time out there as well.', ' I have not was this morning been alive or going well.', "" I've gone to a lot of different places, but this is the first time I've visited a place I really loved."", ' I have not was this morning been alive or mornin age.', ' I went to a family reunion in Jacksonville last summer.', ' I would go to the Lake Champlain.', ""<|startoftext|>What was the place you loved to visit? I've gone to a few places, but never by yourself until recently. I really loved Annie E. in Cambridge, she was my age., She was also the only girl in class.<|end"", ""<|startoftext|>What was the place you loved to visit? I would say home was the worst place I have ever been, It was horrible, I wish I'd gone to Paris but I will never go there, The weather was nice, I wish I'd"", ' I would say my favorite place is my backyard.', ' I would say Dormitory or Petrified Forest.', "" I've been in Vegas a few times and been super happy there...until I saw this guy who looked like him."", ' I have been to a few different places in Europe, but I have never been to Paris.', ' I would say truly personal, myerserres the beach.', ' I would say offline over coffee, food, music, video games.', ' I would say the gardens, they were huge.', ' I have been to a few different places in my life, but never by yourself.', ' I have been in Myanmar and Lhasa twice,firstly to celebrate the 50th anniversary of the end of the cold war and secondly as a birthday gone great.', ' I went to a house lit by the river.']",What was the place you loved to visit?
"[' I have been to a few places, but never by yourself.', ' I have been to a few places and it is great to be part of something special.', ' I like places that evoke some sort of place, e.g. a museum or a movie theatre.', '<|startoftext|>Do you have a favorite place you have been? I like places that are different from my own. I like museums, I like to go places with my friends.[/endoftext|>||startoftext|>\n<|start', ' I think Kyoto or Berlin, maybe Paris.', ' I love traveling. I love meeting new people.', ' I have been to a few places, but nothing as exciting as Paris.', ' I would say Sesame Street.', "" I visited a friend's in Argentina and she said yes because it was the last place I'd ever go to sing."", ' I loved Chappaquiddick, it was so beautiful.', ' I love the Boston Tea Shop.', '<|startoftext|>Do you have a favorite place you have been? I have been to a few countries in the world that have Meteor, Warcraft III, and Star Wars: The Old Republic games out of my system and they are by far my favorite.<|endof', ' I have been visited by over a million people, and had the pleasure of my life numerous times.', ' I like places I can travel and I love traveling.', ' I have been to Rome and everywhere by the Sea.', ' I like places that are different, like a museum, or just hanging out in a nice neighborhood.', ' I really enjoy going to the beach.', ' I liked Mturk about the beach.', ' I like places that are interesting, unexpected, funny, full of life events, wonderful outdoors, music, fashion, people, friendship.', ' I loved walking along the Delaware in high school.']",Do you have a favorite place you have been?
"[' I have not travelled much in recent years but been to a few European countries(Austria, France, Germany), Rome as well', ' I have not travelled much in recent years but been to a few places I really wanted to go, India, China, Germany, Japan, Korea.', ' I have not travelled much in recent years but been to a few countries and I will keep you posted on your travels.', ' I have not travelled much in recent years but been to several places growing up., I love travelling.', ' I have not travelled much in recent years but been to several European countries.', ' I have not travelled much in recent years but been to a few Latin summer camps in England.', ' I have not travelled much in recent years but been to a few countries I really wanted to go to, Germany, France, UK.', ' I would like to go to a party, but I want to go to a restaurant first.', ' I have not travelled much in recent years but been to a few countries that havean interesting history,', ' I have not travelled much in recent years, I have wanted to go to far Africa, Europe, Australia.', ""<|startoftext|>What was your favorite place that you've travelled? I have not travelled much in recent years but been to several European countries(Austria, France, Germany, Netherlands, UK) Although I have not been to the UK, I do like it.<"", ' I have not travelled much in recent years but been to several places growing up., I love London and England.', ' I have not travelled much in the past, I have been to several places that were difficult to reach by road, but that were easy to navigate returned home.', ' I have not travelled much in recent years but been to a few European countries.', ' I have not travelled much in recent years, I have been to a few countries, but not in Europe.', ' I have not travelled much in recent years but been to several places growing up., I love traveling.', ""<|startoftext|>What was your favorite place that you've travelled? I have not travelled much in recent years but been to a few of the smaller markets like china, Japan, the Netherlands, UK, Germany, France, Japan...<|endoftext|"", ' I have not travelled much in recent years but been to a few countries/territories I have notovles time.', ""<|startoftext|>What was your favorite place that you've travelled? I have not travelled much in recent years but been to a few European countries(USA,Germany,IV France) Although I have not been to Rome as of yet, I will come back soon.<"", ' I have not travelled much in recent years but been to a few countries, Myanmar, France, Germany, Japan, UK, Austria, Netherlands, Italy, UK.']",What was your favorite place that you've travelled?
"["" I would have to say Flanders, they're both incredible places to be a tourist."", "" I'd say you should go for the mountains."", "" I would have to say 9/10> It's a mess."", "" you can't beat that beautiful beach."", ' I think Paris is really good.', ' Ibiet, iberian, etc.', ' thats a tough one.', ""<|startoftext|>What's your favorite place in Europe? I would have to say really big cities like Paris,teri for me are really interesting because of its huge concentration of life events, clubs, restaurants, you name it.<|endoftext|"", ' thats a tough one.', ' thats a tough one.', ' I would like to stay in Paris forever.', "" I think Kyoto, they're both amazing.... It's hilarious."", ' I would like to go to the beach in England.', "" There's literally not much going on in Europe...other than Cologne."", ' You must be looking for a bad summer.', "" I've only ventured there once, but it was really nice there."", ' thats a tough one.', ' thats a tough one.', ' thats a tough one.', ' I would have to say Mainester in Paris.']",What's your favorite place in Europe?
"["" I've been to a few around the downtown area, but none of them were as exciting as I've been to see here."", "" I've been in Arizona a few times already and it's pretty hot there too!"", "" I've been to a few around the Great Lakes, but not Chicago."", "" I've been in Vegas a few times and it's still pretty amazing."", "" I've been to a few different places, but this is my eleventh movie...so it's my favorite place."", "" I've been in Vegas a few times already and it's pretty awesome there."", "" I've been to a few around the world, but not in Australia."", ""<|startoftext|>Where's the coolest place you've been? I've been to a few different places, but none of them were as exciting as I am. The weather is nice, and the view is great, you just have to be super prepared.<|"", "" I've been to a few different places, but none of them were as crazy crazy as this!"", "" I've been to a few different places, but nothing as amazing as Anaheim, California."", ' Chicago has always been at the top of my list.', "" I've been to a few of those places, but haven't been as lucky."", ""<|startoftext|>Where's the coolest place you've been? I've been to a few different places and am pretty certain I've been to at least one of the last decade's worth of Fed meetings, none of which have beeneventuallybeen held.<|"", "" I've been to a few of those places out of state, NC by the way."", "" I've been to a few places, but not as many as I'd like."", "" I've been in a few different places, but been pretty negative on the weather."", "" I've been to a few different places, but none of them were as exciting as this incredible place."", "" I've been to a few places, but this is the craziest."", ' Chicago is cool.', "" I've been to a few of those places out of school, and I love spending time with family.""]",Where's the coolest place you've been?
"[' I loved the tourist area in Cambridge.', "" I think Kyoto but I don't actually go there much anymore."", ' I have not been to any of those places, although I think Boston is cooler.', "" I don't remember; maybe Lake Champlain."", "" I'm in the Midwest."", ' I loved Mturk.', ' I was in Savannah for a month, visiting from Massachusetts.', "" I'm in Jacksonville, Florida."", "" I think Kyoto or Berlin, but I don't remember where."", ' I have not been to much of a place.', ' I mean....', ' I have not been to much of a place.', ' I loved Tokyo and Kyoto.', '<|startoftext|>Where was your favorite place in <location>? I have not been to any of those places, but I think we can agree on one thing: there is a great deal of opportunity for any one of those places to have a part of it,', ' I loved Mturk.', ' I love Tokyo.', ' I have not been to much of a place.', ' I think Kyoto or Berlin, in Japan.', "" I mean, I don't actually have a house in Cambridge."", ' I mean it was cool there.']",Where was your favorite place in <location>?
"[' I went to Mount Rushmore in New England, not Boston.', ' I went to the Dominican last year.', ' I went to a party at a nice college campus last year.', ' I went to the Dominican last year.', ' I went to the Dominican last year.', ' I went to the Dominican last year.', ' I went to the Dominican last year.', "" I went to a friend's wedding last year."", ' I went to the Dominican last year.', ' I went to Caltech, which is back in 2013.', ' I went to the Dominican last year.', ' I went to the Dominican last year.', ' Upstate NY near Syracuse.', ' I went to Mturk.', ' I went to the Dominican last year.', ' I went to Roseburg, I think I might go back to Potomac.', ' I went to South Beach a long time ago.', ' I went to a party in LA this past summer.', ' I went to the Dominican last year.', ' I went to the Dominican last year.']",Where's the last place you went?
"["" I mean I grew up in the '00s and '00s."", "" I almost cried at the end of college, but since I'm female I don't have to worry about it."", "" I mean I've really like living in Detroit, actually I grew up in Texas."", "" I mean I've lived in Illinois for about 9 years now."", ' I pretty much died in college.', "" I mean, I've been in humans for about 8 years, so about 8 years."", ' I mean I grew up in Nevada.', ' I think some of my early years were spent in Bethlehem.', ' I almost died over here.', "" No, I've lived in California my whole life."", "" I'm a homemaker."", "" No, I've lived in Illinois my whole life."", ' I have.', ' I have.', ' I mean I grew up in Wisconsin.', ' No.', "" No, I'm a homemaker."", "" No, I've been in religion for almost 2 years now."", "" I'm not sure."", ' I have.']",Have you lived in <location> all of your life?
"["" I'm a partner of over 20 years, I bake and do a few things."", ' I am a college administrator.', '<|startoftext|>what do you do that is important to you in your life? I am the sole cook in a small restaurant near by that does not have a lot of food. I cook a lot of different things and help out with the prep for the next meal.<|end', "" That's cool."", ' I have studied business management and I run my own business.', ' I have studied business management and I run my own business.', "" That's cool, I also like to play the violin and sing."", ' I am a sports fan so I like to watch games and do a bit of everything.', ' I am a college administrator.', ' I am a student at the Kennedy School and I mediate in my own time.', "" I'm a partner of about 15 people and I run my own business."", ' I am a teacher.', ' I am a college administrator.', ' I have worked in the nonprofit sector for 15 years now and have worked for over 20 years in restaurants.', ' I am the wife of a MasterCard customer, and I teach others to too.', ' I am a college administrator.', ' I have studied business management and I run my own business.', ' I am a college administrator.', ' I am a college administrator.', ' I have worked in the real estate business for over 20 years, and I play a few sports as well.']",what do you do that is important to you in your life?
"[' Pretty well.', ' Pretty well.', "" It's okay."", ' Pretty well.', ' My life is pretty normal so far: I have lots of debt, so when I have money I end up spending it on clothes, cars, etc.', ' Pretty good.', ' Pretty good.', ' Pretty good.', ' Wow, life is pretty awful haha. I feel bad for the other people around me.', ' Pretty well.', ' My life is great.', ' Pretty well.', "" It's good so far."", "" I'm good."", ' Pretty well.', ' My day is going well.', ' Hey there, my life is pretty damn interesting.', "" It's pretty easy here."", "" I'm fine."", "" I'm fine.""]",How's life?
"['<|startoftext|>what is your favorite thing about life? Being a vegetarian is pretty incredible haha haha haha haha haha haha haha haha haha haha haha haha haha haha haha haha haha haha haha haha haha haha haha haha haha haha haha haha haha haha haha haha haha haha', "" I'd probably get a bicycle, but not a car. I like to play basketball so I also like to play tennis."", ' Being human.', ' Love birds, frogs, snakes, strawberries, and bicycles.', "" I'm pretty terrible haha, I love pizza."", ' Life is too short to be boring haha, I like to travel really well.', ' I mean life.', ' I want to say eat yourself to death, but I also really enjoy movie night.', '<|startoftext|>what is your favorite thing about life? Being human! I love cooking, collecting bones, finding food,... Oh yeah, I also love shopping! I really enjoy shopping, I love walking... and I love yoga.<|endoftext', ""<|startoftext|>what is your favorite thing about life? I would say watching movies is one of the most fulfilling and fulfilling things I have ever had the chance to do, it's a combination of meetings, reading books, and having fun in general.<|"", "" I'm kind of lazy, I fill about 5 minutes a day with nothing but noise and tears."", ' I like to play the violin. I also like playing classical music.', ' I pretty much just love doing stuff.', ' I would say eating, this is the most favorite thing i see in the sky is one of the most amazing things i have ever seen.', ' I got obsessed with finding out what kind of a person I really was. I love collecting animals and also computers.', "" I don't actually have a favorite thing about life (though I love pie). I like being able to go anywhere and feel free to go anywhere."", ' Being human. I like to cook, play sports, go out in nature, do all of these things, and i really enjoy the outdoors.', ' Being married for life is one of the hardest things to wrap my head around.', '<|startoftext|>what is your favorite thing about life? Being human. I like to play video games, play Magic: The Gathering, watch Netflix, go to bars, go to live music events, eat lots of food,<|endoftext|', "" I love reading, movies, cooking, golf, the beach, hiking, and my girlfriend's dog, is it yours? yeah, I love reading.""]",what is your favorite thing about life?
"["" A) If you don't mind me asking, yes, I do sometimes."", ' Life is always changing.', "" Don't assume anything from reading chat logs."", ' She and her fiance both died from cancer.', "" Shehe.. if you don't mind me asking,are you vegetarian? Yeah I'm an atheist so I get all the tips."", ' She does a lot of running and reading.', ' She does a lot of volunteering for cancer research.', "" Shehe, I don't really have any life experiences or experiences... I've done a few but none really like being drugged."", ' Pretty good, in my opinion.', "" I don't usually get into life advice, but I would say to stay positive and always strive for consistency."", ' Pretty good, thanks.', "" I wish I could be extra precise, but I've never had a life event like that."", ""<|startoftext|>Any life experience tip? I've never quit smoking, but I feel like I've been taking more than I should be taking in, like naloxone and my husband has been taking so well. <|endof"", ' She does a lot of reading and movie watching.', ""<|startoftext|>Any life experience tip? Yeah I've always had family members as friends, I've been in and out of clubs my whole adult life, and I've had people I didn't even know when I was little...people I"", ' She also loves swimming!.', "" Don't sweat it."", "" Don't sweat it."", "" Don't assume any responsibility for your life. Live by the rules."", ""<|startoftext|>Any life experience tip? I think you could say that I'm lacking in empathy. - lots of my friends are psychopathy-free, why not everyone else? - is it because of age?- everyone is different.<""]",Any life experience tip?
"["" Yeah, I've been in business school "", "" Yeah, I've been married for about 8 years now."", ' No.', "" Yeah, I've been in business school."", ' No.', "" No, I've been married for about 8 years now and have a daughter."", ' No.', "" I've lived in it most of my adult life. I'm a robot."", ' No.', ' No.', ' No.', ' No, I have lived in Argentina my whole life.', ' No, I have lived alone my whole life.', ' No.', ' I have lived in my parents basement for most of my adult life.', "" Yeah, I've been in companies ranging from teachers to bartenders to name a few."", "" Yeah, I've been to around leopard."", "" I've lived with my parents for about 8 years."", "" Yeah, I've lived here my whole life."", "" I've lived in my parents basement for 8 years.""]",Have you live in <location> your entire life?
"[' My friends, we get together with friends and form bonds over drinks or just hanging out with ourselves.', ' I really enjoy cooking, gaming, hiking, and just hanging out with china.', ' I really like to go out for lunch with some friends and just leave my clothes at home.', "" I really enjoy cooking, which is nice but I'm 31, it's been years."", ' My friends, we get so much out of making friends out in the neighborhood, even though we are kids, we are still very shy sometimes.', "" My friends, we get together every now and then and it's great to see what's going on in the world. "", "" When I'm not chatting online, I like to travel and I like to party."", ' I really enjoy cooking, gaming, and traveling.', ' I really like watching movies online, which I enjoy doing.', ' My friends.', ""<|startoftext|>Any particular activites you like to do with friends? When I'm not doing schoolwork or traveling, I like to be out doing something fun like watching sports (basketball, tennis, etc.) That way I can be with friends whenever I'm free,"", ' I really enjoy creating art, I also enjoy playing video games.', ' I really enjoy walking, the weather can be choppy.', ' I really like to go out to eat with some friends or just walking around the area.', "" I really like to go out to bars on the weekends, or go to my friends' houses occasionally."", "" I really enjoy walking, the trees, the flowers...it's really nice to be part of something like this."", ' I really enjoy speading my time with family, as well as working as a teacher.', ""<|startoftext|>Any particular activites you like to do with friends? When possible, I'll be walking my dog, which is a bit inconvenient, but when I have him on his own, I enjoy sitting by the water while playing video games, hiking, and watching"", ' I really like to go out to bars or anywhere.', ' I really enjoy cooking, the library, the beach, hiking, and the baseball playoffs.']",Any particular activites you like to do with friends?
