answers,question
"[' No pets, I have 3 dogs', ' Yeah i have 2 dogs.', ' Yeah i have 3 dogs', ' Yeah i have 3 dogs', ' Yeah i have 3 dogs and 2 cats.', '<|startoftext|>Do you have any pets? No pets. We have 2 dogs, ages 8 and 9, who are both so scared of snakes our first thought was a prank, but the 2 day old is so cute when she sees it.<', ' Yeah i have 3 dogs.', "" No, I don't have any pets ."", ' Yeah i have 3 dogs.', ' Yeah i have 3 dogs.', ' Yeah, I have 3 dogs. ', ' Yeah i have 2 dogs.', "" No, I don't have any pets."", ' Yeah i have 2 dogs.', ' Yeah i have 3 dogs.', ' Yeah i have 3 dogs.', ' Yeah i have 3 dogs', ' No pets, but I have a dog and she is my everyday thing, so I love to pet her.\n', ' Yeah i have 2 dogs.', ' Yeah i have 3 dogs.']",Do you have any pets?
"[' Not really.', "" Yeah, I'm actually a dad to a 3 year old daughter."", "" Yeah, I'm actually a triplet so I have a brother and sister who are both my age."", "" Yeah, I'm actually a triplet so I have a brother and sister who are both my age."", ' No siblings.', ' Not currently.', "" Yeah I'm actually a triplet so I have a brother and sister who are both my age."", "" Yeah I'm actually a triplet so I have a brother and sister who are both my age."", ' Not currently.', ' No, not really.', '<|startoftext|>Do you have any siblings? No siblings.\n<|link href=""http://wapo.st/2hv4r?text=<|startoftext|>How\'s the weather by your count, Tom', "" Yeah, I'm actually a triplet so I have a brother and sister who are both my age."", "" Yeah, I'm actually a triplet so I have a brother and sister who are both my age."", ' No siblings.', "" Yeah, I'm his age."", "" Yeah, I'm actually a triplet so I have a brother and sister who are both my age."", "" No siblings. Kind of weird. I'm from the Midwest."", ' Not right now.', ' Not right now.', "" Yeah, I'm actually a triplet so I have a brother and sister who are both my age.""]",Do you have any siblings?
"[' No, but I have one great sister who is 14 years old.', ' No, but I have one brother.', "" No, but I have a sister who is 6'4, which is okay with me."", "" No, I don't have a sister."", ' Yes, I have a sister who lives with me.', ' No, but I have a brother.', "" I'm not really into fashion."", "" No, I don't have any sisters."", ' No, but I have one great aunt.', ' No, but I have a sister who is my age.', "" I'mond not a niece."", ' No, but I have a sister who is my age.', ' Yes, I have a sister who is 4 and my significant other was her age.', ' No, but I have a cousin.', ' No, not a chance.', "" No, I don't have a sister."", ' No, but I have a brother who is my age.', ' No, not a bad sister.', "" I've only had my sister, but she's a lesbian, so he or she is my whole family."", ' No, not a single sister.']",Do you have any sisters?
"["" Yeah, we're one. Just like him."", ' I have 2 very similar brothers.', ' A cousin.', ' Yeah, I have three brothers.', ' A brother and sister.', ' I have one sister.', ' Yeah I have a brother who is doing astronaut study so I have a brother who is doing astronomy.', ' Yeah, three.', ' Yeah, I have a brother who is doing this for free here at Harvard.', ' Not really.', ' Yeah I have a brother who is doing med school.', ' Yeah, I have three brothers.', "" Yeah, Dad has me so I've got a brother and a sister who are both my age."", ' Like me, he is from the Midwest.', ' Yeah, I have three brothers.', ' Yeah, I have three brothers.', ' Yeah, one is 4 and the other 2 is 3.', "" Yeah, I'm triplet girl."", ' A brother and a sister.', ' Yeah, I have one brother.']",Do you have any brothers?
"[' My daughter is 14 and my son is 7.', "" They're 14 and 15."", "" They're 14 and 15."", ' My daughter is 14. How old are yours? My daughter is 14.', "" They're 14 and 15."", ' My daughter is 14 years old.', ' My daughter is 14 and my son is 7.', ' My daughter is 14 years old.', ' My daughter is 14 years old.', ' My daughter is 14. How old are yours? My daughter is 14. Freaking hot.', ' My daughter is 14 and my son is 7.', ' My daughter is 14 years old.', ' My daughter is 14 years old.', "" They're 14 and 15."", ' My daughter is 14 and my son is 7.', ' My daughter is 14 years old.', ' My daughter is 14 and my son is 7.', ' My daughter is 14 and my son is 7.', '<|startoftext|>how old are your kids? My daughter is 14. How old are you? My daughter is 14. How old are your kids? My daughter is 14. How old are your kids? My daughter is 14 is 14.8', '<|startoftext|>how old are your kids? My daughter is 14. How old are yours? My daughter is 14. How old are yours? My daughter is 14. How old are yours? My daughter is 14. How old are yours?']",how old are your kids?
"[' Aww, I love cats. ', ' Aww, I love cats.', "" Aww, I'm the brunt of his ire, though."", ' Aww, I love cats.', ' Aww, I love cats.', "" Aww, I'm a proky dog."", ' Aww, I love cats.', ' Aww, I love cats.', "" Aww, I'm the worst guy around, "", ' Aww, I love cats.', "" Aww, I'm a kennel nurse."", ' Aww, I love cats.', ' Aww, I love cats.', "" Aww, I'm the worst fan!"", ' Aww, I love cats.', "" Aww, I have a rat and i'm taking him for a playdate."", "" Aww, I'm a lab cat guy."", ' Aww, I love cats.', ' Aww, I love cats.', ' Aww, I love cats. ']",Do you have dogs or cats?
"["" I'm not sure."", "" I'm not sure."", '', "" I'm not sure."", "" I'm not sure."", "" I'm not sure what I'd do with my life without children. I have two grown kids and a 2 year old. "", ' Well...probably not as much as I would like.', "" I'm not sure."", "" I don't have kids and am working on it."", "" I'm not sure."", "" I'm not sure."", "" I'm not sure."", ' Grandma wants me to be a mom.', "" I'm not sure."", "" I'm not sure."", "" I'm not sure."", "" I'm not sure what I want anymore."", ' ', "" I'm not sure how I'm going to deal with kids if I don't have kids."", "" I'm not sure why I want kids...probably it's the stress of not having a job anymore.""]",Do you want kids?
"["" I'm not married."", "" I'm not married."", ' Yes I am married here in Philadelphia.', "" I'm not married."", "" I am not married and I don't have any children."", "" I'm not married."", "" I'm not married and I don't have any kids."", "" No I'm not married."", ""<|startoftext|>Are you married? Yes, I married John S.''|endoftext|>\n<|startoftext|>What do you do for a living? I work in a retail store.<|endoftext"", "" Yes, I'm married here."", ' Yes I am married with a daughter and a son-in-law.', ' I am not married and do not have any children.', ' Yes I am married with children.', ' No, but since I was 15, I got a restraining order against me, which I used to keep secret from the rest of the family.', '<|startoftext|>Are you married? Yes I am married with one daughter and we are both very passionate about making sure our children are well enough to learn about and understood science and math, representation in media, science fiction, and fantasy,', "" No, I'm not married."", ' I am not married.', "" I'm not married."", "" No I'm not married."", ' Yes I am married with 4 kids.']",Are you married?
"[' I have three sons and daughter.', ' I have three sons and daughter.', ' Only one daughter.', ' Only one dad and his brother.', ' I have three grown kids.', ' none, none, none, none.', ' Most of my Christian friends have at least one of my Christian friends.', "" There's one my sister got from home."", ' I have three grown kids.', ' I have one daughter.', ' There are 2 boys and a girl.', ' I have two boys.', ' Only one dad and his brother. My dad is originally from Stow, but he has since relocated to Phoenix to work.', ' I have two sons and daughter.', '<|startoftext|>How many are in your family? Some are 4 and 2 years old. 2 are from around the age of 9 and the other was 11. The youngest child is 8 and she is my age she can tell me anything about any subject', ' A brother and sister.', ' Some are 8 and 6.', ' There is one my daughter has cerebral palsy.', ""<|startoftext|>How many are in your family? none major other than Jesus Christ I have had many people asking what I have been doing for the past 2 decades like job hunting, I don't have a computer, but I know how to program and"", ' Some are 14 and 15, 15 is 16 and 17.']",How many are in your family?
"[' I guess you would say city.', "" I guess you could say i'm in between."", ' I guess you would say city.', ' I guess you would say city.', ' I guess you would say city.', ' I guess you would say city.', ' I guess you would say city.', ' I guess you could say city.', ' I guess you would say city.', ' I guess you would say city.', ' I guess you would say city.', ' I guess you would say city.', ' I guess you would say city.', ' I guess you would say city.', ' I guess you would say city.', ' I guess you would say city.', ' I guess you would say city.', ' I guess you would say city.', ' I guess you would say city.', ' I guess you would say city.']",Do you live in the city or country?
"["" I guess you could say i'm in between."", "" I guess you could say i'm in between."", "" I guess you could say i'm in between."", "" I guess you could say i'm in between."", "" I guess you could say i'm in between."", "" I guess you could say i'm in between."", "" I guess you could say i'm in between."", "" I guess you could say i'm in between."", "" I guess you could say i'm in between."", "" I guess you could say i'm in between."", "" I guess you could say i'm in between."", "" I guess you could say i'm in between."", "" I guess you could say i'm in between."", "" I guess you could say i'm in between."", "" I guess you could say i'm in between."", "" I guess you could say i'm in between."", "" I guess you could say i'm in between."", "" I guess you could say i'm in between."", "" I guess you could say i'm in between."", "" I guess you could say i'm in between.""]",Do you live near a city or are you in the country?
"["" I'm from the Caribbean."", ' I am from South Australia, in Brisbane.', ' I am from Brazil.', ' I am from Brazil.', "" I'm from the Caribbean."", "" I'm from the UK."", ' I am from Brazil.', ' I am from Brazil.', ' I am from Brazil.', ' I am from Brazil.', "" I'm from the Caribbean."", "" I'm from the Caribbean."", "" I'm from the UK."", ' I am from South Africa.', "" I'm from the Netherlands."", ' I am from Brazil.', "" I'm from the Caribbean."", ' I am from Brazil.', "" I'm from Brazil."", "" I'm from Sweden.""]",What country are you from?
"[' I am in Jacksonville but went down to Tampa a few months ago for work, It was really nice there.', ' Very poor, actually.', ' I am in South East Texas.', ' I am in Jacksonville but went down to Tampa a few months ago for work, It was really nice there.', ' I am in Virginia.', ' I am in Jacksonville but went down to Tampa a few months ago for work, It was really nice there.', ' Very poor country.', ' I am in Jacksonville but went down to Tampa a few months ago for work, It was really nice there.', ' I am in the southern part of Virginia.', ' Very poor.', "" I'm in the southern part of Indiana."", ' I am in Virginia.', ' I am in the southern part of Illinois.', ' I am in Jacksonville but went down to Tampa a few months ago for work, It was really nice there.', ' I am in Jacksonville but went down to Tampa a few months ago for work, It was really nice there.', ' I am in Jacksonville but went down to Tampa a few months ago for work, It was really nice there.', ' I am in Jacksonville, Florida.', ' I am in Delaware but went back to home state for college, I am in New York.', ' I am in Jacksonville, Florida.', ' I am in Jacksonville but went down to Tampa a few months ago for work, It was really nice there.']",What part of the country are you in?
"[' No I am not married.', "" Yeah, I've been married for about 8 years now, and I have a daughter."", "" No, I'm not a married person."", "" I'm not married."", "" No, I'm not a married person."", "" I'm not."", "" Yeah..I think I'm a widow."", ' Yes, I am married, but that is not my style.', "" No.. I'm not married."", ' I am not.', ' Yes, I am married, but I feel guilty about it.', ' I am not.', "" I am not and I don't have any kids."", "" Yeah, I've been married for about 8 years now, and have a daughter who will be turning two."", ' I am not a married person.', ' Yes, I am married.', ' Yes, I am married, but I have a daughter.', "" Yeah, I'm not."", "" Yeah, I'm single."", ' No, I am not a married person.']",Are you a married person?
"[' I guess.', "" I'm in Europe, but not for the moment."", ' I guess.', ' I guess...kingdom USA.', ' pretty much.', ' I guess.', "" Really? It's a combination of Europe and North America."", ' I guess.', ' I guess.', ' I guess.', ' I guess.', ' I guess.', ' I guess.', ' I guess.', ' I guess.', ' I guess.', ' I guess.', ' I guess.', ' literally.', ' Latin America.']",which is ur home country?
"[' I am from the US.', "" I'm from the US."", "" I'm from the US"", "" I'm from the US."", ' I am from the US.', ' I am from the US.', "" I'm from the US."", "" I'm from the US."", ' I am from the US.', "" I'm from the US."", ' I am from the US.', "" I'm from the US"", "" I'm from the US."", "" I'm from the US."", "" I'm from the US."", "" I'm from the US."", "" I'm from the US."", "" I'm from the US, about 50 kilometers (27 miles) east of Paris."", ' Argentina.', "" I'm from the US.""]",What part of the world are you from?
"["" I'm in Argentina."", "" I'm in Pennsylvania."", "" I'm in Pennsylvania."", "" I'm in Pennsylvania."", ' I am in Colorado.', ' I am in Pennsylvania.', "" I'm from the south east."", "" I'm in Pennsylvania."", ' I am from the US.', "" I'm in Pennsylvania."", "" I'm in Pennsylvania."", "" I'm in Pennsylvania."", "" I'm in Pennsylvania."", "" I'm in Pennsylvania."", "" I'm in Pennsylvania."", "" I'm in Pennsylvania."", "" I'm in Argentina."", "" I'm in Argentina."", "" I'm in Pennsylvania."", "" I'm in Pennsylvania.""]",What part of the world do you live in?
"[' I live in Alabama.', ' I live in Alabama.', ' I live in Alabama.', ' I live in Texas.', ' I live in Alabama.', ' I live in Alabama.', ' I live in Alabama.', ' I live in Alabama.', ' I live in Alabama.', ' I live in Alabama.', ' I live in Alabama.', ' I live in Alabama.', ' I live in Alabama.', ' I live in Alabama.', ' I live in Texas.', ' I live in the USA.', ' I live in Alabama.', ' I live in Alabama.', ' I live in Alabama.', ' I live in Alabama.']",Where in the world do you live?
"[' Seattle, originally.', ' Seattle, originally.', ' I live in the southern part of England.', ' London, probably around 2m. ', ' I live in the southeast.', ' Seattle, originally.', ' Seattle, originally.', ' Chicago, originally.', ' I live in the USA.', ' Seattle, originally.', ' Seattle, originally.', ' London.', ' Chicago: i am in Florida.', ' Seattle, originally.', ' Chicago: i am in New York.', ' London, the UK.', ' Seattle, originally.', ' I live in the southern part of England.', ' Seattle, originally.', ' I live in the southern half of England.']",where in the world are you?
"[' Aww, I love him. :)\n\n', ' Aww, I love him. ', '<|startoftext|>Do you have dogs? Yep, I have a rat and I have had people walk by her until she bit her husband and ran away. Haha, is that dog hilarious? Haha yes, its hilarious.<|end', "" No, I don't....her toy is a bull terrier, so I don't have any of that."", ' Aww, I love him. ', ' Aww, I have a ratty little brother.', ' A friend has 3 dogs.', ' A friend has 3 dogs.', ' Yes, I have a Husky and a Beagle.', ' A male and a female, we have a gelding and we have a terrapin.', ' Aww, I love him. ', ' No, but I have 3 dogs and she is 7 and my husband is allergic to most dogs foods.', ' Aww, I love him/her.', ' Yep, she is a Husky/German Shepard mix.', ' Aww, I love him/her.', ' Aww, I got a rat.', '<|startoftext|>Do you have dogs? Aww, I love him. :)\n\n|endoftext|>What about you? I love dogs! :)\n\n|endoftext|>Do you do MTurk full', ' No, but I have 3 dogs.', ' Aww, I like cats. ', ' Aww, I love him. ']",Do you have dogs?
"["" I'm not sure."", "" I'm not a fan of dogs either."", "" I'm not a fan of dogs either."", ' Aww, I love cats. ', ' Aww, I love cats. ', "" I'm not sure."", "" I'm a big fan of dogs."", '<|startoftext|>do you like cats or dogs? I\'m a dog person|>\n<|title>What\'s your favorite piece to play? I aboslutely love jazz so I might have to say ""Beyond the Sea"" although', ' Aww, I love cats.', ' Aww, I love dogs.', ' I love dogs', "" I'm not sure why I think dogs are such a big deal in my head."", "" I'm not really sure."", ' Aww, I love cats.', ' That cat is incredible. ', "" I'm not really sure."", "" I'm not really sure."", "" Aww, I'm a dog person."", "" I'm not really sure. I think I'm more of a cat person than a dog person."", ' Aww, I love cats. ']",do you like cats or dogs?
"[' Yes, i have a rat husband and wife that is also her own worst enemy.', ' I have 3 dogs, his name is terry.', ' No, but I have a foster family.', ' Yes, Husky and Orca, we have 2 puppies', "" Yep, I have a poodle named Jazz and a poodle named Jazz's-a-Mole."", ' Yep, I have a poodle named Cliff.', ' Yeah, my dogs are 9/11 friendly.', ' Yeah, I have a Canine Grand Duke and Granddaughters.', ' I have 3 little dogs.', ' Yep, I have a Retriever and my Dad has him.', ' Yeah, I have a Husky and a Maltese named after me.', "" Yeah, I've been having graphic or fetish stuff with my family."", ' My dog is a German Shepherd named Zoolander.', ' No, but my mom has three dogs.', ' Yeah, 3 year old hers have 3/4 year old and granddaughterss have 1/4 year old.', ' No, but my granddaughters have been harassing me online.', ' No, but my daughter has been giving me directions to dumpster diving.', ' No, but my family. ', ' I have 2 small dogs and her name is Bella. We have not_dog>\n', ' Yeah, I have 3 dogs.']",Do you have any dogs of your own?
"[' Vegetarianism is fun because it involves less cooking and less waste than most other foods.', ' Different styles of chicken, steak, and just meat in general.', ' Different styles of chicken, steak, and just meat in general.', ' Different styles of chicken, steak, and just meat in general.', ' I like to cook a lot of different things, from edibles to craft brews to large scale nonprofit events.', ' Different varieties of chicken, steak, and just meat in general.', ' I like to cook a lot of different things, from edibles to desserts.', ' I like to cook a lot of different kinds of food, from scratch to food to drink to craft beer to even pizza.', ' A lot of eggs, lots of pasta, and saucy white guy things.', ' Different styles of chicken, steak, and just meat in general.', '<|startoftext|>What types of things do you like to cook? I cook a lot of different things, like prepare meals, help with homework, make sure bottles are full, help with computers, assist with alarms, assist in online store buying, assist in finding things', ' Different styles of chicken, steak, and just meat in general.', ' Different styles of chicken, steak, and just meat in general.', ' I like to bake, I bake, bake, bake.', ' Different styles of chicken, steak, and just meat in general.', ' I like to cook a lot of different things, from ice cream to perfumes.', ' Mostly pasta.', ' I like a lot of different things.', ' A lot of eggs, lots of sausage.', ' I like to cook a lot of different things, from muffins to wraps.']",What types of things do you like to cook?
"['<|startoftext|>favorite food? I have never eaten anything by a dog food court has ever been set up for dogs and cats but not before giving me a chance to pet a golden retriever or yellow lab.<|endoftext', ' I have been eating ramen for about a week and it is incredible how good ramen is.', ' I have never eaten anything by a child.', ' I like most of the food in my family.', ' I have been eating sushi and brown rice recently but my GF and I do not have time until today.', ' I love orange pie.', ' I love fajitas.', ' I like everything about eating that is good--pasta, fries,oroi, mioi.', ' I have not had enough of any.', ' I have never eaten anything by a non-human being.', ' I have never eaten anything by a human being.', ' I have been traveling a lot lately, having booked big events and also traveling with my fiance.', ' Yeah, I like chicken parmesan.', "" I've eaten pizza here and there times."", "" I've eaten pizza twice this day, and my girlfriend and I go to a baseball game each year."", ' I have never been a fan of hot dogs.', ' This is the perfect one.', '<|startoftext|>favorite food? I like all kinds of food, including pasta, rice, rice, beans, lentil curry, sausage, curry, celery, carrots, but no onions. I like chicken as well.<|', ' I have not had any food in over 15 years but this is my lucky day.', ' I have not had enough of any.']",favorite food?
"[' I cook a lot of different kinds of food, from scratch to protein to desserts to go-karts.', ' I cook a lot of different things, like pancakes, sausages, fajitas, stews, etc.', ' I like cooking WAY too much pasta.', ' I cook a lot of different things and have been cooking for a long time, so pasta, eggs, rice, sausages.', ' I make a lot of Italian food.', ' I usually cook most meals with the vegetables, fruit, and some kind of meat. ', '<|startoftext|>what type of food do you like to cook? I cook a lot of different things, like waffles, french fries, sausages, hosiery, brownies...basic.</|endoftext|>\n<|startoftext', ' I cook a lot of different things than just pasta.', ' I cook a lot of different things and have had relationships growing up that were never married for over 10 years.', ' I have been baking for about 8 years and am eating something different like pasta.', ' I make a lot of Italian food.', "" I've been training for over an hour in an office environment, eating, drinking beer, and having fun."", "" I have notoathedraw so I've had plenty of food."", "" I've been baking in my spare time since January, so pasta is my second cooking skill after food."", ' I cook a lot of different kinds of food like pizza, pasta, chicken, etc.', ' I cook a lot of Italian food.', '<|startoftext|>what type of food do you like to cook? I cook a lot of different things, like pancakes, French toast, Italian breakfast, Indian lunch, Indian dinner, Indian spa, Indian housewarming, Kimo cooking, Tiffany & Joey cookbook,', "" I've been baking lately, and it's fun to see what is new and what is old."", ' I like to cook a lot of different things and I cook for pleasure.', ' I cook a lot of different things, usually I am taking walks along the river or at the beach.']",what type of food do you like to cook?
"[' I like to eat pasta or rice with a side of fresh vegetables and eggs.', ' I like brownies and poutine.', ' I like to eat pasta, rice, brown rice, sausages, gratin, firewood, brown rice cakes, etc.', ""<|startoftext|>what type of food do you like to eat? I like to eat whatever's on the menu,all types of food like pancakes, french fries, sausages, apple pie, brownies, brownies but I also add red wine vinegar to"", ' I like to eat pasta or rice.', "" I like cooking, but I don't have a lot of experience with- um, I do like to eat."", ' I like to eat anything.', ' I like to eat anything.', ' I like to cook mostly food.', ""<|startoftext|>what type of food do you like to eat? I like to eat pasta or rice but I also eggs, as eggs are hard to make fully developed children's taste buds bleed - typically just like they do in middle school).<|endoftext"", ' I like to eat pasta or rice, but I also favours eggs.', "" I like cooking, too, but I don't have a lot of time with family."", ' I like to eat pizza,eggs,breakfasts,all day.', ' I like to eat pasta, rice, eggs, eggs, but I also favore pizza.', ' I like to eat pasta, rice, brown rice, brown rice, egg whites, sour cream, banana, chocolate chips.', ' I like to eat rice, eggs, pasta, rice, brown rice, but I also cook in chicken broth.', "" I like brownies or IGI but I don't have a favorite yet."", ""<|startoftext|>what type of food do you like to eat? I like cooking, eggs, dairy, eggs, sausages, popsicles, pancakes, fudge, brownies, but I also fondly remember eating french fries, but I don't remember"", ' I like all types of food, like fresh vegetables, eggs, rice, crackers.', '<|startoftext|>what type of food do you like to eat? I like to eat pizza or pizza, but I also like to watch MMA fights. I also like to play video games, workout, listen to music, drink, wear most anything.<|endof']",what type of food do you like to eat?
"[' I do quite a bit.', ' I do quite a bit.', ' I usually do about once or twice a month.', "" I'm pretty awful at most games."", ' I do a few times a month.', ' I do a few times a month.', "" I'm usually at my computer or in my spare time when I have time."", ' I do a few times a month.', ' I do odd jobs at a gas station.', "" I'm usually at work, so I'm usually at work."", ' I do odd jobs at a gas station.', "" I usually play when I'm nap, but I do sometimes have sessions."", ' I do a lot of play sports.', "" I'm usually in the side lane."", ' I do a lot of comedy, though I have been in musicians only since I was 17, so maybe 15 or 16.', "" I'm usually at the library reading or on a tour bus, but on Sundays I do whatever I can to play."", ' I usually do one a week.', "" I usually play when I'm good."", "" I'm on Odesk Dynasty, and it's fun, though I normally play games, I play more cooperatively."", "" I get the occasional urge to play, but it's really just an excuse to blow off steam.""]",How often do you play <wild>?
